{"data":{"mdx":{"code":{"body":"function _extends() { _extends = Object.assign || function (target) { for (var i = 1; i < arguments.length; i++) { var source = arguments[i]; for (var key in source) { if (Object.prototype.hasOwnProperty.call(source, key)) { target[key] = source[key]; } } } return target; }; return _extends.apply(this, arguments); }\n\nfunction _objectWithoutProperties(source, excluded) { if (source == null) return {}; var target = _objectWithoutPropertiesLoose(source, excluded); var key, i; if (Object.getOwnPropertySymbols) { var sourceSymbolKeys = Object.getOwnPropertySymbols(source); for (i = 0; i < sourceSymbolKeys.length; i++) { key = sourceSymbolKeys[i]; if (excluded.indexOf(key) >= 0) continue; if (!Object.prototype.propertyIsEnumerable.call(source, key)) continue; target[key] = source[key]; } } return target; }\n\nfunction _objectWithoutPropertiesLoose(source, excluded) { if (source == null) return {}; var target = {}; var sourceKeys = Object.keys(source); var key, i; for (i = 0; i < sourceKeys.length; i++) { key = sourceKeys[i]; if (excluded.indexOf(key) >= 0) continue; target[key] = source[key]; } return target; }\n\n/* @jsx mdx */\nvar _frontmatter = {\n  \"title\": \"My college journey\",\n  \"coverFile\": \"./images/diploma.jpg\",\n  \"coverURL\": \"\",\n  \"author\": \"Fadee Kannah\",\n  \"authorTwitter\": \"@fadeenk\",\n  \"publisher\": \"MrKannah.com\",\n  \"dateModified\": \"2019-06-18T00:00:00.000Z\",\n  \"date\": \"2019-06-18T00:00:00.000Z\",\n  \"completed\": \"2019-06-18T00:00:00.000Z\",\n  \"category\": \"Personal\",\n  \"tags\": [\"SDSU\", \"School\", \"Business\", \"Work\"]\n};\n\nvar makeShortcode = function makeShortcode(name) {\n  return function MDXDefaultShortcode(props) {\n    console.warn(\"Component \" + name + \" was not imported, exported, or provided by MDXProvider as global scope\");\n    return mdx(\"div\", props);\n  };\n};\n\nvar layoutProps = {\n  _frontmatter: _frontmatter\n};\nvar MDXLayout = \"wrapper\";\nreturn function MDXContent(_ref) {\n  var components = _ref.components,\n      props = _objectWithoutProperties(_ref, [\"components\"]);\n\n  return mdx(MDXLayout, _extends({}, layoutProps, props, {\n    components: components,\n    mdxType: \"MDXLayout\"\n  }), mdx(\"p\", null, mdx(\"figure\", _extends({\n    parentName: \"p\"\n  }, {\n    \"className\": \"gatsby-resp-image-figure\",\n    \"style\": {}\n  }), \"\\n    \", mdx(\"a\", _extends({\n    parentName: \"figure\"\n  }, {\n    \"className\": \"gatsby-resp-image-link\",\n    \"href\": \"/static/3ee297e238ad815b580672d30ea971f6/110f7/diploma.jpg\",\n    \"style\": {\n      \"display\": \"block\"\n    },\n    \"target\": \"_blank\",\n    \"rel\": [\"noopener\"]\n  }), \"\\n    \", mdx(\"span\", _extends({\n    parentName: \"a\"\n  }, {\n    \"className\": \"gatsby-resp-image-wrapper\",\n    \"style\": {\n      \"position\": \"relative\",\n      \"display\": \"block\",\n      \"marginLeft\": \"auto\",\n      \"marginRight\": \"auto\",\n      \"maxWidth\": \"690px\"\n    }\n  }), \"\\n    \", mdx(\"span\", _extends({\n    parentName: \"span\"\n  }, {\n    \"className\": \"gatsby-resp-image-background-image\",\n    \"style\": {\n      \"paddingBottom\": \"75%\",\n      \"position\": \"relative\",\n      \"bottom\": \"0px\",\n      \"left\": \"0px\",\n      \"backgroundSize\": \"cover\",\n      \"display\": \"block\"\n    }\n  })), \"\\n    \", mdx(\"img\", _extends({\n    parentName: \"span\"\n  }, {\n    \"className\": \"gatsby-resp-image-image\",\n    \"style\": {\n      \"width\": \"100%\",\n      \"height\": \"100%\",\n      \"margin\": \"0px\",\n      \"verticalAlign\": \"middle\",\n      \"position\": \"absolute\",\n      \"top\": \"0px\",\n      \"left\": \"0px\",\n      \"boxShadow\": \"inset 0px 0px 0px 400px white\"\n    },\n    \"alt\": \"diploma\",\n    \"title\": \"\",\n    \"src\": \"/static/3ee297e238ad815b580672d30ea971f6/8c996/diploma.jpg\",\n    \"srcSet\": [\"/static/3ee297e238ad815b580672d30ea971f6/6f483/diploma.jpg 173w\", \"/static/3ee297e238ad815b580672d30ea971f6/0fa0d/diploma.jpg 345w\", \"/static/3ee297e238ad815b580672d30ea971f6/8c996/diploma.jpg 690w\", \"/static/3ee297e238ad815b580672d30ea971f6/c8cd5/diploma.jpg 1035w\", \"/static/3ee297e238ad815b580672d30ea971f6/00650/diploma.jpg 1380w\", \"/static/3ee297e238ad815b580672d30ea971f6/110f7/diploma.jpg 2016w\"],\n    \"sizes\": \"(max-width: 690px) 100vw, 690px\"\n  })), \"\\n  \"), \"\\n  \"), \"\\n    \", mdx(\"figcaption\", _extends({\n    parentName: \"figure\"\n  }, {\n    \"className\": \"gatsby-resp-image-figcaption\"\n  }), \"diploma\"), \"\\n  \")), mdx(\"h3\", {\n    \"id\": \"fall-2010\"\n  }, mdx(\"a\", _extends({\n    parentName: \"h3\"\n  }, {\n    \"href\": \"#fall-2010\",\n    \"aria-label\": \"fall 2010 permalink\",\n    \"className\": \"anchor\"\n  }), mdx(\"svg\", _extends({\n    parentName: \"a\"\n  }, {\n    \"aria-hidden\": \"true\",\n    \"focusable\": \"false\",\n    \"height\": \"16\",\n    \"version\": \"1.1\",\n    \"viewBox\": \"0 0 16 16\",\n    \"width\": \"16\"\n  }), mdx(\"path\", _extends({\n    parentName: \"svg\"\n  }, {\n    \"fillRule\": \"evenodd\",\n    \"d\": \"M4 9h1v1H4c-1.5 0-3-1.69-3-3.5S2.55 3 4 3h4c1.45 0 3 1.69 3 3.5 0 1.41-.91 2.72-2 3.25V8.59c.58-.45 1-1.27 1-2.09C10 5.22 8.98 4 8 4H4c-.98 0-2 1.22-2 2.5S3 9 4 9zm9-3h-1v1h1c1 0 2 1.22 2 2.5S13.98 12 13 12H9c-.98 0-2-1.22-2-2.5 0-.83.42-1.64 1-2.09V6.25c-1.09.53-2 1.84-2 3.25C6 11.31 7.55 13 9 13h4c1.45 0 3-1.69 3-3.5S14.5 6 13 6z\"\n  })))), \"Fall 2010\"), mdx(\"p\", null, \"It all started while, I was in high school. I learned that I would not be able to graduate unless I meet the two years of foreign language. Speaking two other languages natively apparently does not meet the requirement. Since I was cramming four years of high school in two and a half it was not possible to squeeze two years of language classes in.\"), mdx(\"p\", null, \"The only solution was to take night classes at community college. I ended up taking Spanish I which counts as two years of high school language. The best part was I got to double count it for my college requirements as well.\"), mdx(\"h3\", {\n    \"id\": \"spring-2011\"\n  }, mdx(\"a\", _extends({\n    parentName: \"h3\"\n  }, {\n    \"href\": \"#spring-2011\",\n    \"aria-label\": \"spring 2011 permalink\",\n    \"className\": \"anchor\"\n  }), mdx(\"svg\", _extends({\n    parentName: \"a\"\n  }, {\n    \"aria-hidden\": \"true\",\n    \"focusable\": \"false\",\n    \"height\": \"16\",\n    \"version\": \"1.1\",\n    \"viewBox\": \"0 0 16 16\",\n    \"width\": \"16\"\n  }), mdx(\"path\", _extends({\n    parentName: \"svg\"\n  }, {\n    \"fillRule\": \"evenodd\",\n    \"d\": \"M4 9h1v1H4c-1.5 0-3-1.69-3-3.5S2.55 3 4 3h4c1.45 0 3 1.69 3 3.5 0 1.41-.91 2.72-2 3.25V8.59c.58-.45 1-1.27 1-2.09C10 5.22 8.98 4 8 4H4c-.98 0-2 1.22-2 2.5S3 9 4 9zm9-3h-1v1h1c1 0 2 1.22 2 2.5S13.98 12 13 12H9c-.98 0-2-1.22-2-2.5 0-.83.42-1.64 1-2.09V6.25c-1.09.53-2 1.84-2 3.25C6 11.31 7.55 13 9 13h4c1.45 0 3-1.69 3-3.5S14.5 6 13 6z\"\n  })))), \"Spring 2011\"), mdx(\"p\", null, \"My last semester in high school, I finally got the chance to take an AP class. I took AP Economics which allowed me to take the AP test. I ended up passing the AP test and earning credits for another class for the university before even starting.\"), mdx(\"p\", null, \"Additionally, I finished the last part of the business office technology shared program between my high school and Grossmont college. This gave me credits for 5 college courses, however none of them applied to my major.\"), mdx(\"p\", null, \"Finally, the college application, I decided to apply to Educational Opportunity Program (EOP). While I was still finishing my high school senior year, I received another email to apply for the Mathematics, Engineering, Science Achievement (MESA) program.\"), mdx(\"p\", null, \"Both programs offered a lot of services and subprograms that helped me with not just school but also grow personally. Both programs had summer sub-programs that I decided to enroll in!\"), mdx(\"p\", null, mdx(\"figure\", _extends({\n    parentName: \"p\"\n  }, {\n    \"className\": \"gatsby-resp-image-figure\",\n    \"style\": {}\n  }), \"\\n    \", mdx(\"a\", _extends({\n    parentName: \"figure\"\n  }, {\n    \"className\": \"gatsby-resp-image-link\",\n    \"href\": \"/static/8e00747ed8df416b3788614fd63911d0/a7622/transfer.jpg\",\n    \"style\": {\n      \"display\": \"block\"\n    },\n    \"target\": \"_blank\",\n    \"rel\": [\"noopener\"]\n  }), \"\\n    \", mdx(\"span\", _extends({\n    parentName: \"a\"\n  }, {\n    \"className\": \"gatsby-resp-image-wrapper\",\n    \"style\": {\n      \"position\": \"relative\",\n      \"display\": \"block\",\n      \"marginLeft\": \"auto\",\n      \"marginRight\": \"auto\",\n      \"maxWidth\": \"481px\"\n    }\n  }), \"\\n    \", mdx(\"span\", _extends({\n    parentName: \"span\"\n  }, {\n    \"className\": \"gatsby-resp-image-background-image\",\n    \"style\": {\n      \"paddingBottom\": \"48.232848232848234%\",\n      \"position\": \"relative\",\n      \"bottom\": \"0px\",\n      \"left\": \"0px\",\n      \"backgroundSize\": \"cover\",\n      \"display\": \"block\"\n    }\n  })), \"\\n    \", mdx(\"img\", _extends({\n    parentName: \"span\"\n  }, {\n    \"className\": \"gatsby-resp-image-image\",\n    \"style\": {\n      \"width\": \"100%\",\n      \"height\": \"100%\",\n      \"margin\": \"0px\",\n      \"verticalAlign\": \"middle\",\n      \"position\": \"absolute\",\n      \"top\": \"0px\",\n      \"left\": \"0px\",\n      \"boxShadow\": \"inset 0px 0px 0px 400px white\"\n    },\n    \"alt\": \"â€‹\",\n    \"title\": \"\",\n    \"src\": \"/static/8e00747ed8df416b3788614fd63911d0/a7622/transfer.jpg\",\n    \"srcSet\": [\"/static/8e00747ed8df416b3788614fd63911d0/6f483/transfer.jpg 173w\", \"/static/8e00747ed8df416b3788614fd63911d0/0fa0d/transfer.jpg 345w\", \"/static/8e00747ed8df416b3788614fd63911d0/a7622/transfer.jpg 481w\"],\n    \"sizes\": \"(max-width: 481px) 100vw, 481px\"\n  })), \"\\n  \"), \"\\n  \"), \"\\n    \", mdx(\"figcaption\", _extends({\n    parentName: \"figure\"\n  }, {\n    \"className\": \"gatsby-resp-image-figcaption\"\n  }), \"\\u200B\"), \"\\n  \")), mdx(\"h3\", {\n    \"id\": \"summer-2011\"\n  }, mdx(\"a\", _extends({\n    parentName: \"h3\"\n  }, {\n    \"href\": \"#summer-2011\",\n    \"aria-label\": \"summer 2011 permalink\",\n    \"className\": \"anchor\"\n  }), mdx(\"svg\", _extends({\n    parentName: \"a\"\n  }, {\n    \"aria-hidden\": \"true\",\n    \"focusable\": \"false\",\n    \"height\": \"16\",\n    \"version\": \"1.1\",\n    \"viewBox\": \"0 0 16 16\",\n    \"width\": \"16\"\n  }), mdx(\"path\", _extends({\n    parentName: \"svg\"\n  }, {\n    \"fillRule\": \"evenodd\",\n    \"d\": \"M4 9h1v1H4c-1.5 0-3-1.69-3-3.5S2.55 3 4 3h4c1.45 0 3 1.69 3 3.5 0 1.41-.91 2.72-2 3.25V8.59c.58-.45 1-1.27 1-2.09C10 5.22 8.98 4 8 4H4c-.98 0-2 1.22-2 2.5S3 9 4 9zm9-3h-1v1h1c1 0 2 1.22 2 2.5S13.98 12 13 12H9c-.98 0-2-1.22-2-2.5 0-.83.42-1.64 1-2.09V6.25c-1.09.53-2 1.84-2 3.25C6 11.31 7.55 13 9 13h4c1.45 0 3-1.69 3-3.5S14.5 6 13 6z\"\n  })))), \"Summer 2011\"), mdx(\"p\", null, \"EOP offered the \", mdx(\"a\", _extends({\n    parentName: \"p\"\n  }, {\n    \"href\": \"http://studentaffairs.sdsu.edu/EOP/Modern/BEST.html\"\n  }), \"summer bridge\"), \" an intensive preparation program to help students transition to the university lifestyle by developing the necessary skills. MESA offered the \", mdx(\"a\", _extends({\n    parentName: \"p\"\n  }, {\n    \"href\": \"https://casa.sdsu.edu/freshmen/\"\n  }), \"Louis Stokes Alliance for Minority Participation program (LSAMP)\"), \" which offered many benefits such as preparing for calculus, give scholarships, book loans and many other benefits.\"), mdx(\"p\", null, \"That summer was very intense! It was not only a transitional five week of intensive courses but also because I was still learning how to communicate with people. At that time, I had only been in the USA for two and a half years. Additionally, I barely used my English, I spent majority of my time in high school using Arabic or Chaldean just because I did not have the need to use English.\"), mdx(\"p\", null, \"As I was doing my work and minding my own business, the summer bridge mentors noticed something about me, that I did not know was a strength I had till years later. They selected me to be a mentor in the new program Promoting University Learning and Leadership (PULL). I got to mentor a student from high school and have him shadow me for a week.\"), mdx(\"h3\", {\n    \"id\": \"fall-2011--spring-2012\"\n  }, mdx(\"a\", _extends({\n    parentName: \"h3\"\n  }, {\n    \"href\": \"#fall-2011--spring-2012\",\n    \"aria-label\": \"fall 2011  spring 2012 permalink\",\n    \"className\": \"anchor\"\n  }), mdx(\"svg\", _extends({\n    parentName: \"a\"\n  }, {\n    \"aria-hidden\": \"true\",\n    \"focusable\": \"false\",\n    \"height\": \"16\",\n    \"version\": \"1.1\",\n    \"viewBox\": \"0 0 16 16\",\n    \"width\": \"16\"\n  }), mdx(\"path\", _extends({\n    parentName: \"svg\"\n  }, {\n    \"fillRule\": \"evenodd\",\n    \"d\": \"M4 9h1v1H4c-1.5 0-3-1.69-3-3.5S2.55 3 4 3h4c1.45 0 3 1.69 3 3.5 0 1.41-.91 2.72-2 3.25V8.59c.58-.45 1-1.27 1-2.09C10 5.22 8.98 4 8 4H4c-.98 0-2 1.22-2 2.5S3 9 4 9zm9-3h-1v1h1c1 0 2 1.22 2 2.5S13.98 12 13 12H9c-.98 0-2-1.22-2-2.5 0-.83.42-1.64 1-2.09V6.25c-1.09.53-2 1.84-2 3.25C6 11.31 7.55 13 9 13h4c1.45 0 3-1.69 3-3.5S14.5 6 13 6z\"\n  })))), \"Fall 2011 & Spring 2012\"), mdx(\"p\", null, \"That summer set my momentum for the year, I started the fall semester running. I started with 13 units (got a bit worried due to the intensity of the summer programs). However, the following semester, I enrolled in 20 units while continuing to be involved in the EOP, MESA (MEP: Maximizing engineering potential) and LSAMP programs. I also got to participate in the \", mdx(\"a\", _extends({\n    parentName: \"p\"\n  }, {\n    \"href\": \"http://alliance.sdccmesa.com/archives/2595\"\n  }), \"19th MESA Olympics & Robotics competition\"), \".\"), mdx(\"h3\", {\n    \"id\": \"summer-2012\"\n  }, mdx(\"a\", _extends({\n    parentName: \"h3\"\n  }, {\n    \"href\": \"#summer-2012\",\n    \"aria-label\": \"summer 2012 permalink\",\n    \"className\": \"anchor\"\n  }), mdx(\"svg\", _extends({\n    parentName: \"a\"\n  }, {\n    \"aria-hidden\": \"true\",\n    \"focusable\": \"false\",\n    \"height\": \"16\",\n    \"version\": \"1.1\",\n    \"viewBox\": \"0 0 16 16\",\n    \"width\": \"16\"\n  }), mdx(\"path\", _extends({\n    parentName: \"svg\"\n  }, {\n    \"fillRule\": \"evenodd\",\n    \"d\": \"M4 9h1v1H4c-1.5 0-3-1.69-3-3.5S2.55 3 4 3h4c1.45 0 3 1.69 3 3.5 0 1.41-.91 2.72-2 3.25V8.59c.58-.45 1-1.27 1-2.09C10 5.22 8.98 4 8 4H4c-.98 0-2 1.22-2 2.5S3 9 4 9zm9-3h-1v1h1c1 0 2 1.22 2 2.5S13.98 12 13 12H9c-.98 0-2-1.22-2-2.5 0-.83.42-1.64 1-2.09V6.25c-1.09.53-2 1.84-2 3.25C6 11.31 7.55 13 9 13h4c1.45 0 3-1.69 3-3.5S14.5 6 13 6z\"\n  })))), \"Summer 2012\"), mdx(\"p\", null, \"After a year of data and experience in the university, I set my plans to graduate within four and a half years with not only my major but also a computer science minor. I mapped out every single class.\"), mdx(\"p\", null, mdx(\"figure\", _extends({\n    parentName: \"p\"\n  }, {\n    \"className\": \"gatsby-resp-image-figure\",\n    \"style\": {}\n  }), \"\\n    \", mdx(\"a\", _extends({\n    parentName: \"figure\"\n  }, {\n    \"className\": \"gatsby-resp-image-link\",\n    \"href\": \"/static/b4362601ec0fff7b29739fc07ef5c231/97e46/requirements.png\",\n    \"style\": {\n      \"display\": \"block\"\n    },\n    \"target\": \"_blank\",\n    \"rel\": [\"noopener\"]\n  }), \"\\n    \", mdx(\"span\", _extends({\n    parentName: \"a\"\n  }, {\n    \"className\": \"gatsby-resp-image-wrapper\",\n    \"style\": {\n      \"position\": \"relative\",\n      \"display\": \"block\",\n      \"marginLeft\": \"auto\",\n      \"marginRight\": \"auto\",\n      \"maxWidth\": \"690px\"\n    }\n  }), \"\\n    \", mdx(\"span\", _extends({\n    parentName: \"span\"\n  }, {\n    \"className\": \"gatsby-resp-image-background-image\",\n    \"style\": {\n      \"paddingBottom\": \"97.63313609467457%\",\n      \"position\": \"relative\",\n      \"bottom\": \"0px\",\n      \"left\": \"0px\",\n      \"backgroundSize\": \"cover\",\n      \"display\": \"block\"\n    }\n  })), \"\\n    \", mdx(\"img\", _extends({\n    parentName: \"span\"\n  }, {\n    \"className\": \"gatsby-resp-image-image\",\n    \"style\": {\n      \"width\": \"100%\",\n      \"height\": \"100%\",\n      \"margin\": \"0px\",\n      \"verticalAlign\": \"middle\",\n      \"position\": \"absolute\",\n      \"top\": \"0px\",\n      \"left\": \"0px\",\n      \"boxShadow\": \"inset 0px 0px 0px 400px white\"\n    },\n    \"alt\": \"requirements\",\n    \"title\": \"\",\n    \"src\": \"/static/b4362601ec0fff7b29739fc07ef5c231/36727/requirements.png\",\n    \"srcSet\": [\"/static/b4362601ec0fff7b29739fc07ef5c231/acf4b/requirements.png 173w\", \"/static/b4362601ec0fff7b29739fc07ef5c231/fc834/requirements.png 345w\", \"/static/b4362601ec0fff7b29739fc07ef5c231/36727/requirements.png 690w\", \"/static/b4362601ec0fff7b29739fc07ef5c231/97e46/requirements.png 845w\"],\n    \"sizes\": \"(max-width: 690px) 100vw, 690px\"\n  })), \"\\n  \"), \"\\n  \"), \"\\n    \", mdx(\"figcaption\", _extends({\n    parentName: \"figure\"\n  }, {\n    \"className\": \"gatsby-resp-image-figcaption\"\n  }), \"requirements\"), \"\\n  \")), mdx(\"p\", null, \"Since I was used to taking summer classes in high school, I planned on not skipping a single summer semester in the university either.\"), mdx(\"h3\", {\n    \"id\": \"fall-2012--spring-2013\"\n  }, mdx(\"a\", _extends({\n    parentName: \"h3\"\n  }, {\n    \"href\": \"#fall-2012--spring-2013\",\n    \"aria-label\": \"fall 2012  spring 2013 permalink\",\n    \"className\": \"anchor\"\n  }), mdx(\"svg\", _extends({\n    parentName: \"a\"\n  }, {\n    \"aria-hidden\": \"true\",\n    \"focusable\": \"false\",\n    \"height\": \"16\",\n    \"version\": \"1.1\",\n    \"viewBox\": \"0 0 16 16\",\n    \"width\": \"16\"\n  }), mdx(\"path\", _extends({\n    parentName: \"svg\"\n  }, {\n    \"fillRule\": \"evenodd\",\n    \"d\": \"M4 9h1v1H4c-1.5 0-3-1.69-3-3.5S2.55 3 4 3h4c1.45 0 3 1.69 3 3.5 0 1.41-.91 2.72-2 3.25V8.59c.58-.45 1-1.27 1-2.09C10 5.22 8.98 4 8 4H4c-.98 0-2 1.22-2 2.5S3 9 4 9zm9-3h-1v1h1c1 0 2 1.22 2 2.5S13.98 12 13 12H9c-.98 0-2-1.22-2-2.5 0-.83.42-1.64 1-2.09V6.25c-1.09.53-2 1.84-2 3.25C6 11.31 7.55 13 9 13h4c1.45 0 3-1.69 3-3.5S14.5 6 13 6z\"\n  })))), \"Fall 2012 & Spring 2013\"), mdx(\"p\", null, \"For this academic year I slowed down. I took a little bit less units (18 in fall, 16 in spring). This was due to me starting work as an IT for the EOP office and getting involved in student organizations. I joined IEEE, became president for CASU (Chaldean American Student Union), helped start MechaTronics. I also enrolled in the \", mdx(\"a\", _extends({\n    parentName: \"p\"\n  }, {\n    \"href\": \"http://www.sci.sdsu.edu/marc/pre-marc/overview/\"\n  }), \"pre-Marc program\"), \". I also teamed up with awesome people to win the \", mdx(\"a\", _extends({\n    parentName: \"p\"\n  }, {\n    \"href\": \"http://alliance.sdccmesa.com/archives/4170\"\n  }), \"20th MESA Olympics & Robotics Competition\")), mdx(\"h3\", {\n    \"id\": \"summer-2013\"\n  }, mdx(\"a\", _extends({\n    parentName: \"h3\"\n  }, {\n    \"href\": \"#summer-2013\",\n    \"aria-label\": \"summer 2013 permalink\",\n    \"className\": \"anchor\"\n  }), mdx(\"svg\", _extends({\n    parentName: \"a\"\n  }, {\n    \"aria-hidden\": \"true\",\n    \"focusable\": \"false\",\n    \"height\": \"16\",\n    \"version\": \"1.1\",\n    \"viewBox\": \"0 0 16 16\",\n    \"width\": \"16\"\n  }), mdx(\"path\", _extends({\n    parentName: \"svg\"\n  }, {\n    \"fillRule\": \"evenodd\",\n    \"d\": \"M4 9h1v1H4c-1.5 0-3-1.69-3-3.5S2.55 3 4 3h4c1.45 0 3 1.69 3 3.5 0 1.41-.91 2.72-2 3.25V8.59c.58-.45 1-1.27 1-2.09C10 5.22 8.98 4 8 4H4c-.98 0-2 1.22-2 2.5S3 9 4 9zm9-3h-1v1h1c1 0 2 1.22 2 2.5S13.98 12 13 12H9c-.98 0-2-1.22-2-2.5 0-.83.42-1.64 1-2.09V6.25c-1.09.53-2 1.84-2 3.25C6 11.31 7.55 13 9 13h4c1.45 0 3-1.69 3-3.5S14.5 6 13 6z\"\n  })))), \"Summer 2013\"), mdx(\"p\", null, \"I took a break... However, I continued working on my growth and learning. I started working for the education department at San Diego State University as well. I worked on side projects and improving my skills. I focused on programming as much as possible and I built a few simple apps for fun. Because of my late course registration date, I created a script that helped me enroll in classes. The script later became the Aztec Course Snatcher.\"), mdx(\"h3\", {\n    \"id\": \"fall-2013--spring-2014\"\n  }, mdx(\"a\", _extends({\n    parentName: \"h3\"\n  }, {\n    \"href\": \"#fall-2013--spring-2014\",\n    \"aria-label\": \"fall 2013  spring 2014 permalink\",\n    \"className\": \"anchor\"\n  }), mdx(\"svg\", _extends({\n    parentName: \"a\"\n  }, {\n    \"aria-hidden\": \"true\",\n    \"focusable\": \"false\",\n    \"height\": \"16\",\n    \"version\": \"1.1\",\n    \"viewBox\": \"0 0 16 16\",\n    \"width\": \"16\"\n  }), mdx(\"path\", _extends({\n    parentName: \"svg\"\n  }, {\n    \"fillRule\": \"evenodd\",\n    \"d\": \"M4 9h1v1H4c-1.5 0-3-1.69-3-3.5S2.55 3 4 3h4c1.45 0 3 1.69 3 3.5 0 1.41-.91 2.72-2 3.25V8.59c.58-.45 1-1.27 1-2.09C10 5.22 8.98 4 8 4H4c-.98 0-2 1.22-2 2.5S3 9 4 9zm9-3h-1v1h1c1 0 2 1.22 2 2.5S13.98 12 13 12H9c-.98 0-2-1.22-2-2.5 0-.83.42-1.64 1-2.09V6.25c-1.09.53-2 1.84-2 3.25C6 11.31 7.55 13 9 13h4c1.45 0 3-1.69 3-3.5S14.5 6 13 6z\"\n  })))), \"Fall 2013 & Spring 2014\"), mdx(\"p\", null, \"Helped start SDSDS (San Diego Software Development) which was no longer a thing the following semester. I founded and became the president of HTEV (HiTech EdVentures) with the help of my instructor. I continued to grow my skills and became more entrepreneurial by turning my script into a complete desktop application and started selling it to other students.\"), mdx(\"p\", null, \"I also became an unofficial teacher/lab assistant for the intro to programming course. That led me to getting started with private tutoring which was how made some extra cash.\"), mdx(\"h3\", {\n    \"id\": \"summer-2014\"\n  }, mdx(\"a\", _extends({\n    parentName: \"h3\"\n  }, {\n    \"href\": \"#summer-2014\",\n    \"aria-label\": \"summer 2014 permalink\",\n    \"className\": \"anchor\"\n  }), mdx(\"svg\", _extends({\n    parentName: \"a\"\n  }, {\n    \"aria-hidden\": \"true\",\n    \"focusable\": \"false\",\n    \"height\": \"16\",\n    \"version\": \"1.1\",\n    \"viewBox\": \"0 0 16 16\",\n    \"width\": \"16\"\n  }), mdx(\"path\", _extends({\n    parentName: \"svg\"\n  }, {\n    \"fillRule\": \"evenodd\",\n    \"d\": \"M4 9h1v1H4c-1.5 0-3-1.69-3-3.5S2.55 3 4 3h4c1.45 0 3 1.69 3 3.5 0 1.41-.91 2.72-2 3.25V8.59c.58-.45 1-1.27 1-2.09C10 5.22 8.98 4 8 4H4c-.98 0-2 1.22-2 2.5S3 9 4 9zm9-3h-1v1h1c1 0 2 1.22 2 2.5S13.98 12 13 12H9c-.98 0-2-1.22-2-2.5 0-.83.42-1.64 1-2.09V6.25c-1.09.53-2 1.84-2 3.25C6 11.31 7.55 13 9 13h4c1.45 0 3-1.69 3-3.5S14.5 6 13 6z\"\n  })))), \"Summer 2014\"), mdx(\"p\", null, \"I enrolled in two classes. However, since I created and sold Aztec Course Snatcher, I got awarded by getting suspended and getting dropped from my summer classes on the last day of class. That caused me to lose all my work during the summer as well as $100.\"), mdx(\"p\", null, \"At the same time, I got accepted into the Lavin entrepreneurship center. I attended the orientation but because of the suspension I was dropped from the program as well. That led to me to writing \", mdx(\"a\", _extends({\n    parentName: \"p\"\n  }, {\n    \"href\": \"/the-post-that-changed-everything\"\n  }), \"the post that changed everything\"), \".\"), mdx(\"p\", null, mdx(\"figure\", _extends({\n    parentName: \"p\"\n  }, {\n    \"className\": \"gatsby-resp-image-figure\",\n    \"style\": {}\n  }), \"\\n    \", mdx(\"a\", _extends({\n    parentName: \"figure\"\n  }, {\n    \"className\": \"gatsby-resp-image-link\",\n    \"href\": \"/static/f072ad298aba3abb6812c577f7700b9a/74a01/FBPost.png\",\n    \"style\": {\n      \"display\": \"block\"\n    },\n    \"target\": \"_blank\",\n    \"rel\": [\"noopener\"]\n  }), \"\\n    \", mdx(\"span\", _extends({\n    parentName: \"a\"\n  }, {\n    \"className\": \"gatsby-resp-image-wrapper\",\n    \"style\": {\n      \"position\": \"relative\",\n      \"display\": \"block\",\n      \"marginLeft\": \"auto\",\n      \"marginRight\": \"auto\",\n      \"maxWidth\": \"464px\"\n    }\n  }), \"\\n    \", mdx(\"span\", _extends({\n    parentName: \"span\"\n  }, {\n    \"className\": \"gatsby-resp-image-background-image\",\n    \"style\": {\n      \"paddingBottom\": \"70.04310344827587%\",\n      \"position\": \"relative\",\n      \"bottom\": \"0px\",\n      \"left\": \"0px\",\n      \"backgroundSize\": \"cover\",\n      \"display\": \"block\"\n    }\n  })), \"\\n    \", mdx(\"img\", _extends({\n    parentName: \"span\"\n  }, {\n    \"className\": \"gatsby-resp-image-image\",\n    \"style\": {\n      \"width\": \"100%\",\n      \"height\": \"100%\",\n      \"margin\": \"0px\",\n      \"verticalAlign\": \"middle\",\n      \"position\": \"absolute\",\n      \"top\": \"0px\",\n      \"left\": \"0px\",\n      \"boxShadow\": \"inset 0px 0px 0px 400px white\"\n    },\n    \"alt\": \"the post that changed everything\",\n    \"title\": \"\",\n    \"src\": \"/static/f072ad298aba3abb6812c577f7700b9a/74a01/FBPost.png\",\n    \"srcSet\": [\"/static/f072ad298aba3abb6812c577f7700b9a/acf4b/FBPost.png 173w\", \"/static/f072ad298aba3abb6812c577f7700b9a/fc834/FBPost.png 345w\", \"/static/f072ad298aba3abb6812c577f7700b9a/74a01/FBPost.png 464w\"],\n    \"sizes\": \"(max-width: 464px) 100vw, 464px\"\n  })), \"\\n  \"), \"\\n  \"), \"\\n    \", mdx(\"figcaption\", _extends({\n    parentName: \"figure\"\n  }, {\n    \"className\": \"gatsby-resp-image-figcaption\"\n  }), \"the post that changed everything\"), \"\\n  \")), mdx(\"h3\", {\n    \"id\": \"fall-2014--spring-2015\"\n  }, mdx(\"a\", _extends({\n    parentName: \"h3\"\n  }, {\n    \"href\": \"#fall-2014--spring-2015\",\n    \"aria-label\": \"fall 2014  spring 2015 permalink\",\n    \"className\": \"anchor\"\n  }), mdx(\"svg\", _extends({\n    parentName: \"a\"\n  }, {\n    \"aria-hidden\": \"true\",\n    \"focusable\": \"false\",\n    \"height\": \"16\",\n    \"version\": \"1.1\",\n    \"viewBox\": \"0 0 16 16\",\n    \"width\": \"16\"\n  }), mdx(\"path\", _extends({\n    parentName: \"svg\"\n  }, {\n    \"fillRule\": \"evenodd\",\n    \"d\": \"M4 9h1v1H4c-1.5 0-3-1.69-3-3.5S2.55 3 4 3h4c1.45 0 3 1.69 3 3.5 0 1.41-.91 2.72-2 3.25V8.59c.58-.45 1-1.27 1-2.09C10 5.22 8.98 4 8 4H4c-.98 0-2 1.22-2 2.5S3 9 4 9zm9-3h-1v1h1c1 0 2 1.22 2 2.5S13.98 12 13 12H9c-.98 0-2-1.22-2-2.5 0-.83.42-1.64 1-2.09V6.25c-1.09.53-2 1.84-2 3.25C6 11.31 7.55 13 9 13h4c1.45 0 3-1.69 3-3.5S14.5 6 13 6z\"\n  })))), \"Fall 2014 & Spring 2015\"), mdx(\"p\", null, \"I fought back hard!!! I changed the suspension from two years to a single semester and because of my persistence I even managed to move the suspension from the fall to the spring.\"), mdx(\"p\", null, \"Although I was taking 15 units during the fall and was still heavily involved in EOP, MESA, HTEV, IEEE, I decided to help Luke start CourseKey when he reached out during the Fall.\"), mdx(\"p\", null, \"Additionally, I attended the MESA Leadership conference, where I got leadership training. I also got recognized by senator Mark Wyland as well as San Diego State University.\"), mdx(\"p\", null, \"Funny thing, although I was suspended during the spring I was still on campus every single day. I crashed classes to learn, still continued to be involved in my programs and student organizations but most importantly I started focusing on CourseKey.\"), mdx(\"p\", null, \"I also did research with a faculty on campus. I processed Bluetooth signal from new EKG sensors and graphed the data in a Windows universal app.\"), mdx(\"h3\", {\n    \"id\": \"summer-2015\"\n  }, mdx(\"a\", _extends({\n    parentName: \"h3\"\n  }, {\n    \"href\": \"#summer-2015\",\n    \"aria-label\": \"summer 2015 permalink\",\n    \"className\": \"anchor\"\n  }), mdx(\"svg\", _extends({\n    parentName: \"a\"\n  }, {\n    \"aria-hidden\": \"true\",\n    \"focusable\": \"false\",\n    \"height\": \"16\",\n    \"version\": \"1.1\",\n    \"viewBox\": \"0 0 16 16\",\n    \"width\": \"16\"\n  }), mdx(\"path\", _extends({\n    parentName: \"svg\"\n  }, {\n    \"fillRule\": \"evenodd\",\n    \"d\": \"M4 9h1v1H4c-1.5 0-3-1.69-3-3.5S2.55 3 4 3h4c1.45 0 3 1.69 3 3.5 0 1.41-.91 2.72-2 3.25V8.59c.58-.45 1-1.27 1-2.09C10 5.22 8.98 4 8 4H4c-.98 0-2 1.22-2 2.5S3 9 4 9zm9-3h-1v1h1c1 0 2 1.22 2 2.5S13.98 12 13 12H9c-.98 0-2-1.22-2-2.5 0-.83.42-1.64 1-2.09V6.25c-1.09.53-2 1.84-2 3.25C6 11.31 7.55 13 9 13h4c1.45 0 3-1.69 3-3.5S14.5 6 13 6z\"\n  })))), \"Summer 2015\"), mdx(\"p\", null, \"Because I was focusing on CourseKey I decided to skip the summer and drop my minor.\"), mdx(\"h3\", {\n    \"id\": \"fall-2015--spring-2016\"\n  }, mdx(\"a\", _extends({\n    parentName: \"h3\"\n  }, {\n    \"href\": \"#fall-2015--spring-2016\",\n    \"aria-label\": \"fall 2015  spring 2016 permalink\",\n    \"className\": \"anchor\"\n  }), mdx(\"svg\", _extends({\n    parentName: \"a\"\n  }, {\n    \"aria-hidden\": \"true\",\n    \"focusable\": \"false\",\n    \"height\": \"16\",\n    \"version\": \"1.1\",\n    \"viewBox\": \"0 0 16 16\",\n    \"width\": \"16\"\n  }), mdx(\"path\", _extends({\n    parentName: \"svg\"\n  }, {\n    \"fillRule\": \"evenodd\",\n    \"d\": \"M4 9h1v1H4c-1.5 0-3-1.69-3-3.5S2.55 3 4 3h4c1.45 0 3 1.69 3 3.5 0 1.41-.91 2.72-2 3.25V8.59c.58-.45 1-1.27 1-2.09C10 5.22 8.98 4 8 4H4c-.98 0-2 1.22-2 2.5S3 9 4 9zm9-3h-1v1h1c1 0 2 1.22 2 2.5S13.98 12 13 12H9c-.98 0-2-1.22-2-2.5 0-.83.42-1.64 1-2.09V6.25c-1.09.53-2 1.84-2 3.25C6 11.31 7.55 13 9 13h4c1.45 0 3-1.69 3-3.5S14.5 6 13 6z\"\n  })))), \"Fall 2015 & Spring 2016\"), mdx(\"p\", null, \"I applied for a leave of absence for the fall. However, I still wanted finish school. I tested the water by taking three classes and working on CourseKey. That didn't go as smoothly as I liked! School ended up being more of a distraction and pain.\"), mdx(\"h3\", {\n    \"id\": \"summer-2016---spring-2018\"\n  }, mdx(\"a\", _extends({\n    parentName: \"h3\"\n  }, {\n    \"href\": \"#summer-2016---spring-2018\",\n    \"aria-label\": \"summer 2016   spring 2018 permalink\",\n    \"className\": \"anchor\"\n  }), mdx(\"svg\", _extends({\n    parentName: \"a\"\n  }, {\n    \"aria-hidden\": \"true\",\n    \"focusable\": \"false\",\n    \"height\": \"16\",\n    \"version\": \"1.1\",\n    \"viewBox\": \"0 0 16 16\",\n    \"width\": \"16\"\n  }), mdx(\"path\", _extends({\n    parentName: \"svg\"\n  }, {\n    \"fillRule\": \"evenodd\",\n    \"d\": \"M4 9h1v1H4c-1.5 0-3-1.69-3-3.5S2.55 3 4 3h4c1.45 0 3 1.69 3 3.5 0 1.41-.91 2.72-2 3.25V8.59c.58-.45 1-1.27 1-2.09C10 5.22 8.98 4 8 4H4c-.98 0-2 1.22-2 2.5S3 9 4 9zm9-3h-1v1h1c1 0 2 1.22 2 2.5S13.98 12 13 12H9c-.98 0-2-1.22-2-2.5 0-.83.42-1.64 1-2.09V6.25c-1.09.53-2 1.84-2 3.25C6 11.31 7.55 13 9 13h4c1.45 0 3-1.69 3-3.5S14.5 6 13 6z\"\n  })))), \"Summer 2016 - Spring 2018\"), mdx(\"p\", null, \"Because of the spring 2016 semester I decided to shelf school for a while till I can ensure it won't interfere with CourseKey. However, since CourseKey is a startup, we never have enough resources or bandwidth for me to take care finishing school.\"), mdx(\"p\", null, \"Since I had used up all of my leave of absence, the school informed me that I would have to retake all my major courses if I don't finish soon. This is due to a policy where the accreditation no longer applies since the curriculum has most likely changed.\"), mdx(\"h3\", {\n    \"id\": \"summer-2018\"\n  }, mdx(\"a\", _extends({\n    parentName: \"h3\"\n  }, {\n    \"href\": \"#summer-2018\",\n    \"aria-label\": \"summer 2018 permalink\",\n    \"className\": \"anchor\"\n  }), mdx(\"svg\", _extends({\n    parentName: \"a\"\n  }, {\n    \"aria-hidden\": \"true\",\n    \"focusable\": \"false\",\n    \"height\": \"16\",\n    \"version\": \"1.1\",\n    \"viewBox\": \"0 0 16 16\",\n    \"width\": \"16\"\n  }), mdx(\"path\", _extends({\n    parentName: \"svg\"\n  }, {\n    \"fillRule\": \"evenodd\",\n    \"d\": \"M4 9h1v1H4c-1.5 0-3-1.69-3-3.5S2.55 3 4 3h4c1.45 0 3 1.69 3 3.5 0 1.41-.91 2.72-2 3.25V8.59c.58-.45 1-1.27 1-2.09C10 5.22 8.98 4 8 4H4c-.98 0-2 1.22-2 2.5S3 9 4 9zm9-3h-1v1h1c1 0 2 1.22 2 2.5S13.98 12 13 12H9c-.98 0-2-1.22-2-2.5 0-.83.42-1.64 1-2.09V6.25c-1.09.53-2 1.84-2 3.25C6 11.31 7.55 13 9 13h4c1.45 0 3-1.69 3-3.5S14.5 6 13 6z\"\n  })))), \"Summer 2018\"), mdx(\"p\", null, \"I decided to try finishing the school by taking a single class. It turned out to be a piece of cake. The demand of a startup was nothing compared to a writing class. I ended up getting a B+ with minimal effort and focus on the course.\"), mdx(\"h3\", {\n    \"id\": \"fall-2018--spring-2019\"\n  }, mdx(\"a\", _extends({\n    parentName: \"h3\"\n  }, {\n    \"href\": \"#fall-2018--spring-2019\",\n    \"aria-label\": \"fall 2018  spring 2019 permalink\",\n    \"className\": \"anchor\"\n  }), mdx(\"svg\", _extends({\n    parentName: \"a\"\n  }, {\n    \"aria-hidden\": \"true\",\n    \"focusable\": \"false\",\n    \"height\": \"16\",\n    \"version\": \"1.1\",\n    \"viewBox\": \"0 0 16 16\",\n    \"width\": \"16\"\n  }), mdx(\"path\", _extends({\n    parentName: \"svg\"\n  }, {\n    \"fillRule\": \"evenodd\",\n    \"d\": \"M4 9h1v1H4c-1.5 0-3-1.69-3-3.5S2.55 3 4 3h4c1.45 0 3 1.69 3 3.5 0 1.41-.91 2.72-2 3.25V8.59c.58-.45 1-1.27 1-2.09C10 5.22 8.98 4 8 4H4c-.98 0-2 1.22-2 2.5S3 9 4 9zm9-3h-1v1h1c1 0 2 1.22 2 2.5S13.98 12 13 12H9c-.98 0-2-1.22-2-2.5 0-.83.42-1.64 1-2.09V6.25c-1.09.53-2 1.84-2 3.25C6 11.31 7.55 13 9 13h4c1.45 0 3-1.69 3-3.5S14.5 6 13 6z\"\n  })))), \"Fall 2018 & Spring 2019\"), mdx(\"p\", null, \"The last two semesters. I took the senior design course which is broken down to two parts one in each semester. I was lucky to be partnered up with an awesome group that assigned me building an app.\"), mdx(\"p\", null, \"I had the app 85% done by the end of the first semester and 98% over winter break. The other classes during both semesters where challenging graduate level engineering courses. However, with the skills and knowledge I have accumulated over the years, I managed to walk into the finals with the need to only get 15% to get a passing grade.\"), mdx(\"h3\", {\n    \"id\": \"tl-dr\"\n  }, mdx(\"a\", _extends({\n    parentName: \"h3\"\n  }, {\n    \"href\": \"#tl-dr\",\n    \"aria-label\": \"tl dr permalink\",\n    \"className\": \"anchor\"\n  }), mdx(\"svg\", _extends({\n    parentName: \"a\"\n  }, {\n    \"aria-hidden\": \"true\",\n    \"focusable\": \"false\",\n    \"height\": \"16\",\n    \"version\": \"1.1\",\n    \"viewBox\": \"0 0 16 16\",\n    \"width\": \"16\"\n  }), mdx(\"path\", _extends({\n    parentName: \"svg\"\n  }, {\n    \"fillRule\": \"evenodd\",\n    \"d\": \"M4 9h1v1H4c-1.5 0-3-1.69-3-3.5S2.55 3 4 3h4c1.45 0 3 1.69 3 3.5 0 1.41-.91 2.72-2 3.25V8.59c.58-.45 1-1.27 1-2.09C10 5.22 8.98 4 8 4H4c-.98 0-2 1.22-2 2.5S3 9 4 9zm9-3h-1v1h1c1 0 2 1.22 2 2.5S13.98 12 13 12H9c-.98 0-2-1.22-2-2.5 0-.83.42-1.64 1-2.09V6.25c-1.09.53-2 1.84-2 3.25C6 11.31 7.55 13 9 13h4c1.45 0 3-1.69 3-3.5S14.5 6 13 6z\"\n  })))), \"TL; DR\"), mdx(\"p\", null, \"After a long eight year journey, I have finally reached my goal of becoming a computer engineer. In the process, I faced many challenges and hurdles that I almost gave up on my goal. However, everything that happened led to me to who I am today. \"), mdx(\"h3\", {\n    \"id\": \"the-journey-based-on-data\"\n  }, mdx(\"a\", _extends({\n    parentName: \"h3\"\n  }, {\n    \"href\": \"#the-journey-based-on-data\",\n    \"aria-label\": \"the journey based on data permalink\",\n    \"className\": \"anchor\"\n  }), mdx(\"svg\", _extends({\n    parentName: \"a\"\n  }, {\n    \"aria-hidden\": \"true\",\n    \"focusable\": \"false\",\n    \"height\": \"16\",\n    \"version\": \"1.1\",\n    \"viewBox\": \"0 0 16 16\",\n    \"width\": \"16\"\n  }), mdx(\"path\", _extends({\n    parentName: \"svg\"\n  }, {\n    \"fillRule\": \"evenodd\",\n    \"d\": \"M4 9h1v1H4c-1.5 0-3-1.69-3-3.5S2.55 3 4 3h4c1.45 0 3 1.69 3 3.5 0 1.41-.91 2.72-2 3.25V8.59c.58-.45 1-1.27 1-2.09C10 5.22 8.98 4 8 4H4c-.98 0-2 1.22-2 2.5S3 9 4 9zm9-3h-1v1h1c1 0 2 1.22 2 2.5S13.98 12 13 12H9c-.98 0-2-1.22-2-2.5 0-.83.42-1.64 1-2.09V6.25c-1.09.53-2 1.84-2 3.25C6 11.31 7.55 13 9 13h4c1.45 0 3-1.69 3-3.5S14.5 6 13 6z\"\n  })))), \"The journey based on data\"), mdx(\"p\", null, mdx(\"figure\", _extends({\n    parentName: \"p\"\n  }, {\n    \"className\": \"gatsby-resp-image-figure\",\n    \"style\": {}\n  }), \"\\n    \", mdx(\"a\", _extends({\n    parentName: \"figure\"\n  }, {\n    \"className\": \"gatsby-resp-image-link\",\n    \"href\": \"/static/e2c03f6d29cd0fcda8b4c416813b12d7/978db/0-2.jpg\",\n    \"style\": {\n      \"display\": \"block\"\n    },\n    \"target\": \"_blank\",\n    \"rel\": [\"noopener\"]\n  }), \"\\n    \", mdx(\"span\", _extends({\n    parentName: \"a\"\n  }, {\n    \"className\": \"gatsby-resp-image-wrapper\",\n    \"style\": {\n      \"position\": \"relative\",\n      \"display\": \"block\",\n      \"marginLeft\": \"auto\",\n      \"marginRight\": \"auto\",\n      \"maxWidth\": \"690px\"\n    }\n  }), \"\\n    \", mdx(\"span\", _extends({\n    parentName: \"span\"\n  }, {\n    \"className\": \"gatsby-resp-image-background-image\",\n    \"style\": {\n      \"paddingBottom\": \"64.91688538932634%\",\n      \"position\": \"relative\",\n      \"bottom\": \"0px\",\n      \"left\": \"0px\",\n      \"backgroundSize\": \"cover\",\n      \"display\": \"block\"\n    }\n  })), \"\\n    \", mdx(\"img\", _extends({\n    parentName: \"span\"\n  }, {\n    \"className\": \"gatsby-resp-image-image\",\n    \"style\": {\n      \"width\": \"100%\",\n      \"height\": \"100%\",\n      \"margin\": \"0px\",\n      \"verticalAlign\": \"middle\",\n      \"position\": \"absolute\",\n      \"top\": \"0px\",\n      \"left\": \"0px\",\n      \"boxShadow\": \"inset 0px 0px 0px 400px white\"\n    },\n    \"alt\": \"â€‹\",\n    \"title\": \"\",\n    \"src\": \"/static/e2c03f6d29cd0fcda8b4c416813b12d7/8c996/0-2.jpg\",\n    \"srcSet\": [\"/static/e2c03f6d29cd0fcda8b4c416813b12d7/6f483/0-2.jpg 173w\", \"/static/e2c03f6d29cd0fcda8b4c416813b12d7/0fa0d/0-2.jpg 345w\", \"/static/e2c03f6d29cd0fcda8b4c416813b12d7/8c996/0-2.jpg 690w\", \"/static/e2c03f6d29cd0fcda8b4c416813b12d7/c8cd5/0-2.jpg 1035w\", \"/static/e2c03f6d29cd0fcda8b4c416813b12d7/978db/0-2.jpg 1143w\"],\n    \"sizes\": \"(max-width: 690px) 100vw, 690px\"\n  })), \"\\n  \"), \"\\n  \"), \"\\n    \", mdx(\"figcaption\", _extends({\n    parentName: \"figure\"\n  }, {\n    \"className\": \"gatsby-resp-image-figcaption\"\n  }), \"\\u200B\"), \"\\n  \"), \"\\n\", mdx(\"figure\", _extends({\n    parentName: \"p\"\n  }, {\n    \"className\": \"gatsby-resp-image-figure\",\n    \"style\": {}\n  }), \"\\n    \", mdx(\"a\", _extends({\n    parentName: \"figure\"\n  }, {\n    \"className\": \"gatsby-resp-image-link\",\n    \"href\": \"/static/250dc9c78cd612270e6aed61192b709b/8868f/3-5.jpg\",\n    \"style\": {\n      \"display\": \"block\"\n    },\n    \"target\": \"_blank\",\n    \"rel\": [\"noopener\"]\n  }), \"\\n    \", mdx(\"span\", _extends({\n    parentName: \"a\"\n  }, {\n    \"className\": \"gatsby-resp-image-wrapper\",\n    \"style\": {\n      \"position\": \"relative\",\n      \"display\": \"block\",\n      \"marginLeft\": \"auto\",\n      \"marginRight\": \"auto\",\n      \"maxWidth\": \"690px\"\n    }\n  }), \"\\n    \", mdx(\"span\", _extends({\n    parentName: \"span\"\n  }, {\n    \"className\": \"gatsby-resp-image-background-image\",\n    \"style\": {\n      \"paddingBottom\": \"68.71165644171779%\",\n      \"position\": \"relative\",\n      \"bottom\": \"0px\",\n      \"left\": \"0px\",\n      \"backgroundSize\": \"cover\",\n      \"display\": \"block\"\n    }\n  })), \"\\n    \", mdx(\"img\", _extends({\n    parentName: \"span\"\n  }, {\n    \"className\": \"gatsby-resp-image-image\",\n    \"style\": {\n      \"width\": \"100%\",\n      \"height\": \"100%\",\n      \"margin\": \"0px\",\n      \"verticalAlign\": \"middle\",\n      \"position\": \"absolute\",\n      \"top\": \"0px\",\n      \"left\": \"0px\",\n      \"boxShadow\": \"inset 0px 0px 0px 400px white\"\n    },\n    \"alt\": \"â€‹\",\n    \"title\": \"\",\n    \"src\": \"/static/250dc9c78cd612270e6aed61192b709b/8c996/3-5.jpg\",\n    \"srcSet\": [\"/static/250dc9c78cd612270e6aed61192b709b/6f483/3-5.jpg 173w\", \"/static/250dc9c78cd612270e6aed61192b709b/0fa0d/3-5.jpg 345w\", \"/static/250dc9c78cd612270e6aed61192b709b/8c996/3-5.jpg 690w\", \"/static/250dc9c78cd612270e6aed61192b709b/c8cd5/3-5.jpg 1035w\", \"/static/250dc9c78cd612270e6aed61192b709b/8868f/3-5.jpg 1141w\"],\n    \"sizes\": \"(max-width: 690px) 100vw, 690px\"\n  })), \"\\n  \"), \"\\n  \"), \"\\n    \", mdx(\"figcaption\", _extends({\n    parentName: \"figure\"\n  }, {\n    \"className\": \"gatsby-resp-image-figcaption\"\n  }), \"\\u200B\"), \"\\n  \"), \"\\n\", mdx(\"figure\", _extends({\n    parentName: \"p\"\n  }, {\n    \"className\": \"gatsby-resp-image-figure\",\n    \"style\": {}\n  }), \"\\n    \", mdx(\"a\", _extends({\n    parentName: \"figure\"\n  }, {\n    \"className\": \"gatsby-resp-image-link\",\n    \"href\": \"/static/025e6142283e8abcf96b998cc76a513e/978db/6-8.jpg\",\n    \"style\": {\n      \"display\": \"block\"\n    },\n    \"target\": \"_blank\",\n    \"rel\": [\"noopener\"]\n  }), \"\\n    \", mdx(\"span\", _extends({\n    parentName: \"a\"\n  }, {\n    \"className\": \"gatsby-resp-image-wrapper\",\n    \"style\": {\n      \"position\": \"relative\",\n      \"display\": \"block\",\n      \"marginLeft\": \"auto\",\n      \"marginRight\": \"auto\",\n      \"maxWidth\": \"690px\"\n    }\n  }), \"\\n    \", mdx(\"span\", _extends({\n    parentName: \"span\"\n  }, {\n    \"className\": \"gatsby-resp-image-background-image\",\n    \"style\": {\n      \"paddingBottom\": \"68.24146981627297%\",\n      \"position\": \"relative\",\n      \"bottom\": \"0px\",\n      \"left\": \"0px\",\n      \"backgroundSize\": \"cover\",\n      \"display\": \"block\"\n    }\n  })), \"\\n    \", mdx(\"img\", _extends({\n    parentName: \"span\"\n  }, {\n    \"className\": \"gatsby-resp-image-image\",\n    \"style\": {\n      \"width\": \"100%\",\n      \"height\": \"100%\",\n      \"margin\": \"0px\",\n      \"verticalAlign\": \"middle\",\n      \"position\": \"absolute\",\n      \"top\": \"0px\",\n      \"left\": \"0px\",\n      \"boxShadow\": \"inset 0px 0px 0px 400px white\"\n    },\n    \"alt\": \"â€‹\",\n    \"title\": \"\",\n    \"src\": \"/static/025e6142283e8abcf96b998cc76a513e/8c996/6-8.jpg\",\n    \"srcSet\": [\"/static/025e6142283e8abcf96b998cc76a513e/6f483/6-8.jpg 173w\", \"/static/025e6142283e8abcf96b998cc76a513e/0fa0d/6-8.jpg 345w\", \"/static/025e6142283e8abcf96b998cc76a513e/8c996/6-8.jpg 690w\", \"/static/025e6142283e8abcf96b998cc76a513e/c8cd5/6-8.jpg 1035w\", \"/static/025e6142283e8abcf96b998cc76a513e/978db/6-8.jpg 1143w\"],\n    \"sizes\": \"(max-width: 690px) 100vw, 690px\"\n  })), \"\\n  \"), \"\\n  \"), \"\\n    \", mdx(\"figcaption\", _extends({\n    parentName: \"figure\"\n  }, {\n    \"className\": \"gatsby-resp-image-figcaption\"\n  }), \"\\u200B\"), \"\\n  \")), mdx(\"h4\", {\n    \"id\": \"grades-breakdown\"\n  }, mdx(\"a\", _extends({\n    parentName: \"h4\"\n  }, {\n    \"href\": \"#grades-breakdown\",\n    \"aria-label\": \"grades breakdown permalink\",\n    \"className\": \"anchor\"\n  }), mdx(\"svg\", _extends({\n    parentName: \"a\"\n  }, {\n    \"aria-hidden\": \"true\",\n    \"focusable\": \"false\",\n    \"height\": \"16\",\n    \"version\": \"1.1\",\n    \"viewBox\": \"0 0 16 16\",\n    \"width\": \"16\"\n  }), mdx(\"path\", _extends({\n    parentName: \"svg\"\n  }, {\n    \"fillRule\": \"evenodd\",\n    \"d\": \"M4 9h1v1H4c-1.5 0-3-1.69-3-3.5S2.55 3 4 3h4c1.45 0 3 1.69 3 3.5 0 1.41-.91 2.72-2 3.25V8.59c.58-.45 1-1.27 1-2.09C10 5.22 8.98 4 8 4H4c-.98 0-2 1.22-2 2.5S3 9 4 9zm9-3h-1v1h1c1 0 2 1.22 2 2.5S13.98 12 13 12H9c-.98 0-2-1.22-2-2.5 0-.83.42-1.64 1-2.09V6.25c-1.09.53-2 1.84-2 3.25C6 11.31 7.55 13 9 13h4c1.45 0 3-1.69 3-3.5S14.5 6 13 6z\"\n  })))), \"Grades breakdown\"), mdx(\"table\", null, mdx(\"thead\", {\n    parentName: \"table\"\n  }, mdx(\"tr\", {\n    parentName: \"thead\"\n  }, mdx(\"th\", _extends({\n    parentName: \"tr\"\n  }, {\n    \"align\": null\n  }), \"Grade\"), mdx(\"th\", _extends({\n    parentName: \"tr\"\n  }, {\n    \"align\": null\n  }), \"Count\"))), mdx(\"tbody\", {\n    parentName: \"table\"\n  }, mdx(\"tr\", {\n    parentName: \"tbody\"\n  }, mdx(\"td\", _extends({\n    parentName: \"tr\"\n  }, {\n    \"align\": null\n  }), \"CR\"), mdx(\"td\", _extends({\n    parentName: \"tr\"\n  }, {\n    \"align\": null\n  }), \"8\")), mdx(\"tr\", {\n    parentName: \"tbody\"\n  }, mdx(\"td\", _extends({\n    parentName: \"tr\"\n  }, {\n    \"align\": null\n  }), \"A\"), mdx(\"td\", _extends({\n    parentName: \"tr\"\n  }, {\n    \"align\": null\n  }), \"13\")), mdx(\"tr\", {\n    parentName: \"tbody\"\n  }, mdx(\"td\", _extends({\n    parentName: \"tr\"\n  }, {\n    \"align\": null\n  }), \"A-\"), mdx(\"td\", _extends({\n    parentName: \"tr\"\n  }, {\n    \"align\": null\n  }), \"2\")), mdx(\"tr\", {\n    parentName: \"tbody\"\n  }, mdx(\"td\", _extends({\n    parentName: \"tr\"\n  }, {\n    \"align\": null\n  }), \"B+\"), mdx(\"td\", _extends({\n    parentName: \"tr\"\n  }, {\n    \"align\": null\n  }), \"9\")), mdx(\"tr\", {\n    parentName: \"tbody\"\n  }, mdx(\"td\", _extends({\n    parentName: \"tr\"\n  }, {\n    \"align\": null\n  }), \"B\"), mdx(\"td\", _extends({\n    parentName: \"tr\"\n  }, {\n    \"align\": null\n  }), \"6\")), mdx(\"tr\", {\n    parentName: \"tbody\"\n  }, mdx(\"td\", _extends({\n    parentName: \"tr\"\n  }, {\n    \"align\": null\n  }), \"B-\"), mdx(\"td\", _extends({\n    parentName: \"tr\"\n  }, {\n    \"align\": null\n  }), \"3\")), mdx(\"tr\", {\n    parentName: \"tbody\"\n  }, mdx(\"td\", _extends({\n    parentName: \"tr\"\n  }, {\n    \"align\": null\n  }), \"C+\"), mdx(\"td\", _extends({\n    parentName: \"tr\"\n  }, {\n    \"align\": null\n  }), \"1\")), mdx(\"tr\", {\n    parentName: \"tbody\"\n  }, mdx(\"td\", _extends({\n    parentName: \"tr\"\n  }, {\n    \"align\": null\n  }), \"C\"), mdx(\"td\", _extends({\n    parentName: \"tr\"\n  }, {\n    \"align\": null\n  }), \"4\")), mdx(\"tr\", {\n    parentName: \"tbody\"\n  }, mdx(\"td\", _extends({\n    parentName: \"tr\"\n  }, {\n    \"align\": null\n  }), \"C-\"), mdx(\"td\", _extends({\n    parentName: \"tr\"\n  }, {\n    \"align\": null\n  }), \"3\")), mdx(\"tr\", {\n    parentName: \"tbody\"\n  }, mdx(\"td\", _extends({\n    parentName: \"tr\"\n  }, {\n    \"align\": null\n  }), \"D\"), mdx(\"td\", _extends({\n    parentName: \"tr\"\n  }, {\n    \"align\": null\n  }), \"1\")))), mdx(\"h4\", {\n    \"id\": \"gpa\"\n  }, mdx(\"a\", _extends({\n    parentName: \"h4\"\n  }, {\n    \"href\": \"#gpa\",\n    \"aria-label\": \"gpa permalink\",\n    \"className\": \"anchor\"\n  }), mdx(\"svg\", _extends({\n    parentName: \"a\"\n  }, {\n    \"aria-hidden\": \"true\",\n    \"focusable\": \"false\",\n    \"height\": \"16\",\n    \"version\": \"1.1\",\n    \"viewBox\": \"0 0 16 16\",\n    \"width\": \"16\"\n  }), mdx(\"path\", _extends({\n    parentName: \"svg\"\n  }, {\n    \"fillRule\": \"evenodd\",\n    \"d\": \"M4 9h1v1H4c-1.5 0-3-1.69-3-3.5S2.55 3 4 3h4c1.45 0 3 1.69 3 3.5 0 1.41-.91 2.72-2 3.25V8.59c.58-.45 1-1.27 1-2.09C10 5.22 8.98 4 8 4H4c-.98 0-2 1.22-2 2.5S3 9 4 9zm9-3h-1v1h1c1 0 2 1.22 2 2.5S13.98 12 13 12H9c-.98 0-2-1.22-2-2.5 0-.83.42-1.64 1-2.09V6.25c-1.09.53-2 1.84-2 3.25C6 11.31 7.55 13 9 13h4c1.45 0 3-1.69 3-3.5S14.5 6 13 6z\"\n  })))), \"GPA\"), mdx(\"table\", null, mdx(\"thead\", {\n    parentName: \"table\"\n  }, mdx(\"tr\", {\n    parentName: \"thead\"\n  }, mdx(\"th\", _extends({\n    parentName: \"tr\"\n  }, {\n    \"align\": null\n  }), \"Type\"), mdx(\"th\", _extends({\n    parentName: \"tr\"\n  }, {\n    \"align\": null\n  }), \"GPA\"))), mdx(\"tbody\", {\n    parentName: \"table\"\n  }, mdx(\"tr\", {\n    parentName: \"tbody\"\n  }, mdx(\"td\", _extends({\n    parentName: \"tr\"\n  }, {\n    \"align\": null\n  }), \"Transfer\"), mdx(\"td\", _extends({\n    parentName: \"tr\"\n  }, {\n    \"align\": null\n  }), \"3.7\")), mdx(\"tr\", {\n    parentName: \"tbody\"\n  }, mdx(\"td\", _extends({\n    parentName: \"tr\"\n  }, {\n    \"align\": null\n  }), \"SDSU\"), mdx(\"td\", _extends({\n    parentName: \"tr\"\n  }, {\n    \"align\": null\n  }), \"3.11\")), mdx(\"tr\", {\n    parentName: \"tbody\"\n  }, mdx(\"td\", _extends({\n    parentName: \"tr\"\n  }, {\n    \"align\": null\n  }), \"Overall\"), mdx(\"td\", _extends({\n    parentName: \"tr\"\n  }, {\n    \"align\": null\n  }), \"3.17\")))), mdx(\"h4\", {\n    \"id\": \"semesters-breakdown\"\n  }, mdx(\"a\", _extends({\n    parentName: \"h4\"\n  }, {\n    \"href\": \"#semesters-breakdown\",\n    \"aria-label\": \"semesters breakdown permalink\",\n    \"className\": \"anchor\"\n  }), mdx(\"svg\", _extends({\n    parentName: \"a\"\n  }, {\n    \"aria-hidden\": \"true\",\n    \"focusable\": \"false\",\n    \"height\": \"16\",\n    \"version\": \"1.1\",\n    \"viewBox\": \"0 0 16 16\",\n    \"width\": \"16\"\n  }), mdx(\"path\", _extends({\n    parentName: \"svg\"\n  }, {\n    \"fillRule\": \"evenodd\",\n    \"d\": \"M4 9h1v1H4c-1.5 0-3-1.69-3-3.5S2.55 3 4 3h4c1.45 0 3 1.69 3 3.5 0 1.41-.91 2.72-2 3.25V8.59c.58-.45 1-1.27 1-2.09C10 5.22 8.98 4 8 4H4c-.98 0-2 1.22-2 2.5S3 9 4 9zm9-3h-1v1h1c1 0 2 1.22 2 2.5S13.98 12 13 12H9c-.98 0-2-1.22-2-2.5 0-.83.42-1.64 1-2.09V6.25c-1.09.53-2 1.84-2 3.25C6 11.31 7.55 13 9 13h4c1.45 0 3-1.69 3-3.5S14.5 6 13 6z\"\n  })))), \"Semesters breakdown\"), mdx(\"table\", null, mdx(\"thead\", {\n    parentName: \"table\"\n  }, mdx(\"tr\", {\n    parentName: \"thead\"\n  }, mdx(\"th\", _extends({\n    parentName: \"tr\"\n  }, {\n    \"align\": null\n  }), \"Type\"), mdx(\"th\", _extends({\n    parentName: \"tr\"\n  }, {\n    \"align\": null\n  }), \"Count\"))), mdx(\"tbody\", {\n    parentName: \"table\"\n  }, mdx(\"tr\", {\n    parentName: \"tbody\"\n  }, mdx(\"td\", _extends({\n    parentName: \"tr\"\n  }, {\n    \"align\": null\n  }), \"Attended\"), mdx(\"td\", _extends({\n    parentName: \"tr\"\n  }, {\n    \"align\": null\n  }), \"14\")), mdx(\"tr\", {\n    parentName: \"tbody\"\n  }, mdx(\"td\", _extends({\n    parentName: \"tr\"\n  }, {\n    \"align\": null\n  }), \"Leave of absence\"), mdx(\"td\", _extends({\n    parentName: \"tr\"\n  }, {\n    \"align\": null\n  }), \"3\")), mdx(\"tr\", {\n    parentName: \"tbody\"\n  }, mdx(\"td\", _extends({\n    parentName: \"tr\"\n  }, {\n    \"align\": null\n  }), \"Skipped\"), mdx(\"td\", _extends({\n    parentName: \"tr\"\n  }, {\n    \"align\": null\n  }), \"2\")), mdx(\"tr\", {\n    parentName: \"tbody\"\n  }, mdx(\"td\", _extends({\n    parentName: \"tr\"\n  }, {\n    \"align\": null\n  }), \"Suspended\"), mdx(\"td\", _extends({\n    parentName: \"tr\"\n  }, {\n    \"align\": null\n  }), \"1\")), mdx(\"tr\", {\n    parentName: \"tbody\"\n  }, mdx(\"td\", _extends({\n    parentName: \"tr\"\n  }, {\n    \"align\": null\n  }), \"Dropped\"), mdx(\"td\", _extends({\n    parentName: \"tr\"\n  }, {\n    \"align\": null\n  }), \"1\")), mdx(\"tr\", {\n    parentName: \"tbody\"\n  }, mdx(\"td\", _extends({\n    parentName: \"tr\"\n  }, {\n    \"align\": null\n  }), \"Summer Attended\"), mdx(\"td\", _extends({\n    parentName: \"tr\"\n  }, {\n    \"align\": null\n  }), \"4\")), mdx(\"tr\", {\n    parentName: \"tbody\"\n  }, mdx(\"td\", _extends({\n    parentName: \"tr\"\n  }, {\n    \"align\": null\n  }), \"Summer Skipped\"), mdx(\"td\", _extends({\n    parentName: \"tr\"\n  }, {\n    \"align\": null\n  }), \"4\")))), mdx(\"p\", null, mdx(\"figure\", _extends({\n    parentName: \"p\"\n  }, {\n    \"className\": \"gatsby-resp-image-figure\",\n    \"style\": {}\n  }), \"\\n    \", mdx(\"a\", _extends({\n    parentName: \"figure\"\n  }, {\n    \"className\": \"gatsby-resp-image-link\",\n    \"href\": \"/static/3305108e362a4543478845954a4ad3d0/81002/semesterUnits%26GPA.jpg\",\n    \"style\": {\n      \"display\": \"block\"\n    },\n    \"target\": \"_blank\",\n    \"rel\": [\"noopener\"]\n  }), \"\\n    \", mdx(\"span\", _extends({\n    parentName: \"a\"\n  }, {\n    \"className\": \"gatsby-resp-image-wrapper\",\n    \"style\": {\n      \"position\": \"relative\",\n      \"display\": \"block\",\n      \"marginLeft\": \"auto\",\n      \"marginRight\": \"auto\",\n      \"maxWidth\": \"482px\"\n    }\n  }), \"\\n    \", mdx(\"span\", _extends({\n    parentName: \"span\"\n  }, {\n    \"className\": \"gatsby-resp-image-background-image\",\n    \"style\": {\n      \"paddingBottom\": \"60.37344398340249%\",\n      \"position\": \"relative\",\n      \"bottom\": \"0px\",\n      \"left\": \"0px\",\n      \"backgroundSize\": \"cover\",\n      \"display\": \"block\"\n    }\n  })), \"\\n    \", mdx(\"img\", _extends({\n    parentName: \"span\"\n  }, {\n    \"className\": \"gatsby-resp-image-image\",\n    \"style\": {\n      \"width\": \"100%\",\n      \"height\": \"100%\",\n      \"margin\": \"0px\",\n      \"verticalAlign\": \"middle\",\n      \"position\": \"absolute\",\n      \"top\": \"0px\",\n      \"left\": \"0px\",\n      \"boxShadow\": \"inset 0px 0px 0px 400px white\"\n    },\n    \"alt\": \"â€‹\",\n    \"title\": \"\",\n    \"src\": \"/static/3305108e362a4543478845954a4ad3d0/81002/semesterUnits%26GPA.jpg\",\n    \"srcSet\": [\"/static/3305108e362a4543478845954a4ad3d0/6f483/semesterUnits%26GPA.jpg 173w\", \"/static/3305108e362a4543478845954a4ad3d0/0fa0d/semesterUnits%26GPA.jpg 345w\", \"/static/3305108e362a4543478845954a4ad3d0/81002/semesterUnits%26GPA.jpg 482w\"],\n    \"sizes\": \"(max-width: 482px) 100vw, 482px\"\n  })), \"\\n  \"), \"\\n  \"), \"\\n    \", mdx(\"figcaption\", _extends({\n    parentName: \"figure\"\n  }, {\n    \"className\": \"gatsby-resp-image-figcaption\"\n  }), \"\\u200B\"), \"\\n  \")), mdx(\"h4\", {\n    \"id\": \"graduation-ceremonies-attended\"\n  }, mdx(\"a\", _extends({\n    parentName: \"h4\"\n  }, {\n    \"href\": \"#graduation-ceremonies-attended\",\n    \"aria-label\": \"graduation ceremonies attended permalink\",\n    \"className\": \"anchor\"\n  }), mdx(\"svg\", _extends({\n    parentName: \"a\"\n  }, {\n    \"aria-hidden\": \"true\",\n    \"focusable\": \"false\",\n    \"height\": \"16\",\n    \"version\": \"1.1\",\n    \"viewBox\": \"0 0 16 16\",\n    \"width\": \"16\"\n  }), mdx(\"path\", _extends({\n    parentName: \"svg\"\n  }, {\n    \"fillRule\": \"evenodd\",\n    \"d\": \"M4 9h1v1H4c-1.5 0-3-1.69-3-3.5S2.55 3 4 3h4c1.45 0 3 1.69 3 3.5 0 1.41-.91 2.72-2 3.25V8.59c.58-.45 1-1.27 1-2.09C10 5.22 8.98 4 8 4H4c-.98 0-2 1.22-2 2.5S3 9 4 9zm9-3h-1v1h1c1 0 2 1.22 2 2.5S13.98 12 13 12H9c-.98 0-2-1.22-2-2.5 0-.83.42-1.64 1-2.09V6.25c-1.09.53-2 1.84-2 3.25C6 11.31 7.55 13 9 13h4c1.45 0 3-1.69 3-3.5S14.5 6 13 6z\"\n  })))), \"Graduation ceremonies attended\"), mdx(\"ul\", null, mdx(\"li\", {\n    parentName: \"ul\"\n  }, \"MESA Graduation\"), mdx(\"li\", {\n    parentName: \"ul\"\n  }, \"EOP Graduation\"), mdx(\"li\", {\n    parentName: \"ul\"\n  }, \"College of Engineering\"), mdx(\"li\", {\n    parentName: \"ul\"\n  }, \"Knights of Columbus Mar Toma Council Graduation\")), mdx(\"h4\", {\n    \"id\": \"was-mentioned-in-the-school-news\"\n  }, mdx(\"a\", _extends({\n    parentName: \"h4\"\n  }, {\n    \"href\": \"#was-mentioned-in-the-school-news\",\n    \"aria-label\": \"was mentioned in the school news permalink\",\n    \"className\": \"anchor\"\n  }), mdx(\"svg\", _extends({\n    parentName: \"a\"\n  }, {\n    \"aria-hidden\": \"true\",\n    \"focusable\": \"false\",\n    \"height\": \"16\",\n    \"version\": \"1.1\",\n    \"viewBox\": \"0 0 16 16\",\n    \"width\": \"16\"\n  }), mdx(\"path\", _extends({\n    parentName: \"svg\"\n  }, {\n    \"fillRule\": \"evenodd\",\n    \"d\": \"M4 9h1v1H4c-1.5 0-3-1.69-3-3.5S2.55 3 4 3h4c1.45 0 3 1.69 3 3.5 0 1.41-.91 2.72-2 3.25V8.59c.58-.45 1-1.27 1-2.09C10 5.22 8.98 4 8 4H4c-.98 0-2 1.22-2 2.5S3 9 4 9zm9-3h-1v1h1c1 0 2 1.22 2 2.5S13.98 12 13 12H9c-.98 0-2-1.22-2-2.5 0-.83.42-1.64 1-2.09V6.25c-1.09.53-2 1.84-2 3.25C6 11.31 7.55 13 9 13h4c1.45 0 3-1.69 3-3.5S14.5 6 13 6z\"\n  })))), \"Was mentioned in the school news\"), mdx(\"p\", null, \"This is just a few links that I could find. (I should have documented them as I found out about them) \"), mdx(\"ul\", null, mdx(\"li\", {\n    parentName: \"ul\"\n  }, mdx(\"a\", _extends({\n    parentName: \"li\"\n  }, {\n    \"href\": \"http://newscenter.sdsu.edu/sdsu_newscenter/news_story.aspx?sid=75337\"\n  }), \"Leaders in STEM\")), mdx(\"li\", {\n    parentName: \"ul\"\n  }, mdx(\"a\", _extends({\n    parentName: \"li\"\n  }, {\n    \"href\": \"http://universe.sdsu.edu/sdsu_newscenter/news_story.aspx?sid=75670\"\n  }), \"Unlocking New Possibilities\")), mdx(\"li\", {\n    parentName: \"ul\"\n  }, mdx(\"a\", _extends({\n    parentName: \"li\"\n  }, {\n    \"href\": \"http://mep.sdsu.edu/engineering/mep/default.aspx?display=updates\"\n  }), \"MESA Students Create Student Engagement Platform\")), mdx(\"li\", {\n    parentName: \"ul\"\n  }, mdx(\"a\", _extends({\n    parentName: \"li\"\n  }, {\n    \"href\": \"http://thedailyaztec.com/47880/opinion/course-snatcher-app-is-an-unfair-advantage/\"\n  }), \"Course snatcher app is an unfair advantage\")), mdx(\"li\", {\n    parentName: \"ul\"\n  }, mdx(\"a\", _extends({\n    parentName: \"li\"\n  }, {\n    \"href\": \"https://www.theodysseyonline.com/how-keep-calm-during-sdsu-registration\"\n  }), \"How To Keep Calm During SDSU Registration\"), \" (cannot find the original article on the daily aztec)\"), mdx(\"li\", {\n    parentName: \"ul\"\n  }, mdx(\"a\", _extends({\n    parentName: \"li\"\n  }, {\n    \"href\": \"http://thedailyaztec.com/66941/news/course-key-boosts-campus-interactivity/\"\n  }), \"Course Key boosts campus interactivity\"))), mdx(\"h4\", {\n    \"id\": \"data-created\"\n  }, mdx(\"a\", _extends({\n    parentName: \"h4\"\n  }, {\n    \"href\": \"#data-created\",\n    \"aria-label\": \"data created permalink\",\n    \"className\": \"anchor\"\n  }), mdx(\"svg\", _extends({\n    parentName: \"a\"\n  }, {\n    \"aria-hidden\": \"true\",\n    \"focusable\": \"false\",\n    \"height\": \"16\",\n    \"version\": \"1.1\",\n    \"viewBox\": \"0 0 16 16\",\n    \"width\": \"16\"\n  }), mdx(\"path\", _extends({\n    parentName: \"svg\"\n  }, {\n    \"fillRule\": \"evenodd\",\n    \"d\": \"M4 9h1v1H4c-1.5 0-3-1.69-3-3.5S2.55 3 4 3h4c1.45 0 3 1.69 3 3.5 0 1.41-.91 2.72-2 3.25V8.59c.58-.45 1-1.27 1-2.09C10 5.22 8.98 4 8 4H4c-.98 0-2 1.22-2 2.5S3 9 4 9zm9-3h-1v1h1c1 0 2 1.22 2 2.5S13.98 12 13 12H9c-.98 0-2-1.22-2-2.5 0-.83.42-1.64 1-2.09V6.25c-1.09.53-2 1.84-2 3.25C6 11.31 7.55 13 9 13h4c1.45 0 3-1.69 3-3.5S14.5 6 13 6z\"\n  })))), \"Data created\"), mdx(\"p\", null, \"Throughout my journey, I kept a folder with all my courses work. This folder grew in size over the years, now that I have graduated it is 28.36 GB. It includes notes, projects, books, lectures, homework assignments and everything related to my education. \"), mdx(\"h4\", {\n    \"id\": \"ways-i-got-money-college-related\"\n  }, mdx(\"a\", _extends({\n    parentName: \"h4\"\n  }, {\n    \"href\": \"#ways-i-got-money-college-related\",\n    \"aria-label\": \"ways i got money college related permalink\",\n    \"className\": \"anchor\"\n  }), mdx(\"svg\", _extends({\n    parentName: \"a\"\n  }, {\n    \"aria-hidden\": \"true\",\n    \"focusable\": \"false\",\n    \"height\": \"16\",\n    \"version\": \"1.1\",\n    \"viewBox\": \"0 0 16 16\",\n    \"width\": \"16\"\n  }), mdx(\"path\", _extends({\n    parentName: \"svg\"\n  }, {\n    \"fillRule\": \"evenodd\",\n    \"d\": \"M4 9h1v1H4c-1.5 0-3-1.69-3-3.5S2.55 3 4 3h4c1.45 0 3 1.69 3 3.5 0 1.41-.91 2.72-2 3.25V8.59c.58-.45 1-1.27 1-2.09C10 5.22 8.98 4 8 4H4c-.98 0-2 1.22-2 2.5S3 9 4 9zm9-3h-1v1h1c1 0 2 1.22 2 2.5S13.98 12 13 12H9c-.98 0-2-1.22-2-2.5 0-.83.42-1.64 1-2.09V6.25c-1.09.53-2 1.84-2 3.25C6 11.31 7.55 13 9 13h4c1.45 0 3-1.69 3-3.5S14.5 6 13 6z\"\n  })))), \"Ways I got money (college related)\"), mdx(\"p\", null, \"This list excludes CourseKey related\"), mdx(\"ul\", null, mdx(\"li\", {\n    parentName: \"ul\"\n  }, \"Financial Aid\"), mdx(\"li\", {\n    parentName: \"ul\"\n  }, \"LSAMP Scholarship\"), mdx(\"li\", {\n    parentName: \"ul\"\n  }, \"Working IT for EOP\"), mdx(\"li\", {\n    parentName: \"ul\"\n  }, \"Working IT for Education Department \"), mdx(\"li\", {\n    parentName: \"ul\"\n  }, \"National Science Foundation Stipend\"), mdx(\"li\", {\n    parentName: \"ul\"\n  }, \"MESA scholarship\"), mdx(\"li\", {\n    parentName: \"ul\"\n  }, \"EOP scholarship\"), mdx(\"li\", {\n    parentName: \"ul\"\n  }, \"Build MESA website\"), mdx(\"li\", {\n    parentName: \"ul\"\n  }, \"Private tutoring\"), mdx(\"li\", {\n    parentName: \"ul\"\n  }, \"HTEV projects\"), mdx(\"li\", {\n    parentName: \"ul\"\n  }, \"Unofficial TA\"), mdx(\"li\", {\n    parentName: \"ul\"\n  }, \"Aztec Course Snatcher\"), mdx(\"li\", {\n    parentName: \"ul\"\n  }, \"Side projects for other students\")), mdx(\"h4\", {\n    \"id\": \"tuition\"\n  }, mdx(\"a\", _extends({\n    parentName: \"h4\"\n  }, {\n    \"href\": \"#tuition\",\n    \"aria-label\": \"tuition permalink\",\n    \"className\": \"anchor\"\n  }), mdx(\"svg\", _extends({\n    parentName: \"a\"\n  }, {\n    \"aria-hidden\": \"true\",\n    \"focusable\": \"false\",\n    \"height\": \"16\",\n    \"version\": \"1.1\",\n    \"viewBox\": \"0 0 16 16\",\n    \"width\": \"16\"\n  }), mdx(\"path\", _extends({\n    parentName: \"svg\"\n  }, {\n    \"fillRule\": \"evenodd\",\n    \"d\": \"M4 9h1v1H4c-1.5 0-3-1.69-3-3.5S2.55 3 4 3h4c1.45 0 3 1.69 3 3.5 0 1.41-.91 2.72-2 3.25V8.59c.58-.45 1-1.27 1-2.09C10 5.22 8.98 4 8 4H4c-.98 0-2 1.22-2 2.5S3 9 4 9zm9-3h-1v1h1c1 0 2 1.22 2 2.5S13.98 12 13 12H9c-.98 0-2-1.22-2-2.5 0-.83.42-1.64 1-2.09V6.25c-1.09.53-2 1.84-2 3.25C6 11.31 7.55 13 9 13h4c1.45 0 3-1.69 3-3.5S14.5 6 13 6z\"\n  })))), \"Tuition\"), mdx(\"p\", null, \"I managed to avoid college dept by working and paying for it. I was fortunate enough to have financial aid cover most of college fees. I ended up having to pay $8,328 out of pocket total.\"));\n}\nMDXContent.isMDXComponent = true;"},"timeToRead":6,"excerpt":"Fall 2010 It all started while, I was in high school. I learned that I would not be able to graduate unless I meet the two years of foreignâ€¦","frontmatter":{"title":"My college journey","coverURL":"","coverFile":{"publicURL":"/static/diploma-3ee297e238ad815b580672d30ea971f6.jpg"},"date":"June 18, 2019","author":"Fadee Kannah","authorTwitter":"@fadeenk","publisher":"MrKannah.com","dateModified":"2019-06-18T00:00:00.000Z","category":"Personal","tags":["SDSU","School","Business","Work"]},"fields":{"slug":"/my-college-journey","date":"2019-06-18T07:00:00.000Z"}}},"pageContext":{"isCreatedByStatefulCreatePages":false,"slug":"/my-college-journey"}}